{
  "languages": [{ "name": "Ruby", "version": "3.2", "share": 0.86 }, { "name": "JavaScript", "share": 0.11 }],
  "frameworks": ["Rails 7.0"],
  "architecture_style": "single-deployable",
  "deployables": [
    { "name": "web", "kind": "web", "path": "." },
    { "name": "worker", "kind": "worker", "path": "." }
  ],
  "datastores": [
    { "kind": "relational", "product": "PostgreSQL", "managed": null, "evidence": ["config/database.yml:3", "Gemfile:14"] }
  ],
  "caches": [],
  "queues": [
    { "product": "Sidekiq", "kind": "queue", "managed": false, "evidence": ["Gemfile:22", "config/sidekiq.yml:1"] }
  ],
  "external_services": [
    {
      "name": "Stripe",
      "category": "payments",
      "in_request_path": true,
      "has_timeout": false,
      "evidence": ["app/services/checkout.rb:88", "Gemfile:41"]
    }
  ],
  "deployment": {
    "containerised": true,
    "orchestration": "none",
    "iac": [],
    "ci": ["GitHub Actions"],
    "environments": ["production", "staging"],
    "evidence": ["Dockerfile:1", ".github/workflows/deploy.yml:1"]
  },
  "background_work": [
    { "name": "nightly digest", "kind": "cron", "evidence": ["config/schedule.rb:12"] }
  ],
  "testing": {
    "frameworks": ["RSpec"],
    "test_file_count": 214,
    "source_file_count": 631,
    "has_integration_tests": true
  },
  "migrations": { "tool": "ActiveRecord", "count": 87, "evidence": ["db/migrate/"] },
  "observability": {
    "structured_logging": false,
    "metrics": false,
    "tracing": false,
    "error_tracking": true,
    "correlation_ids": false,
    "health_checks": true,
    "evidence": ["Gemfile:55", "config/routes.rb:9"]
  },
  "configuration": {
    "secrets_in_env": true,
    "secrets_committed": false,
    "config_files": ["config/application.rb", ".env.example"]
  },
  "repository": {
    "file_count": 1284,
    "commit_count": 3401,
    "first_commit": "2024-03-11",
    "last_commit": "2026-08-01",
    "contributors": 6
  },
  "undetermined": [
    "Actual production traffic — no analytics configuration found in the repository",
    "Whether the database is managed or self-hosted — no infrastructure-as-code present"
  ]
}
